[{"context":"웹 기능을 네이티브로 다시 만들면 화면과 데이터 규칙이 두 벌로 갈라졌습니다.","date":"2026-07-25","decision":"동일한 서버 웹 화면을 데스크톱 wrapper에서 재사용했습니다.","event_id":"curated-revision-001","outcome":"한 UI를 유지하면서 데스크톱 실행 진입점을 제공했습니다.","stage":"revision","title":"Revision"},{"context":"기존 로컬 데이터를 무시하면 데스크톱 전환 과정에서 사용 기록이 끊겼습니다.","date":"2026-07-25","decision":"로컬 데이터 이전과 지속 저장 위치를 별도 운영 절차로 정의했습니다.","event_id":"curated-decision-001","outcome":"화면 배포와 사용자 데이터 수명을 분리해 관리하게 됐습니다.","stage":"decision","title":"Decision"}]
