[{"context":"완전 문자열 일치만 사용하면 의미가 같은 다양한 정답 표현을 오답으로 처리했습니다.","date":"2026-04-18","decision":"정규화와 동의어 처리 뒤 의미 유사도 판정 경로를 추가했습니다.","event_id":"curated-revision-001","outcome":"표현 차이와 실제 오답을 더 안정적으로 구분할 수 있게 됐습니다.","stage":"revision","title":"Revision"},{"context":"모든 단어를 같은 빈도로 보여주면 학습 세션이 길고 약점 복습이 늦어졌습니다.","date":"2026-04-18","decision":"우선순위 기반의 제한된 카드 세션을 구성했습니다.","event_id":"curated-decision-001","outcome":"학습량을 제한하면서 반복 실패 항목을 먼저 다룰 수 있게 됐습니다.","stage":"decision","title":"Decision"}]
