[{"context":"모호한 짧은 발화와 capability 경계가 단일 프롬프트에서 반복 충돌했습니다.","date":"2026-03-15","decision":"판단 단계를 계층형 라우팅과 specialist 경로로 분해했습니다.","event_id":"curated-revision-001","outcome":"경계 오류의 발생 단계를 추적할 수 있게 됐습니다.","stage":"revision","title":"Revision"},{"context":"런타임과 평가가 같은 역할을 맡으면 실패 원인을 분리하기 어려웠습니다.","date":"2026-03-15","decision":"실제 라우팅과 judge 평가를 독립된 계약으로 운영했습니다.","event_id":"curated-decision-001","outcome":"품질 수치와 실행 경로를 함께 검증할 수 있게 됐습니다.","stage":"decision","title":"Decision"}]
