[{"context":"인증과 메모리 파일을 도구별 구현에 직접 묶으면 운영 경계가 반복해서 바뀌었습니다.","date":"2026-03-19","decision":"인증 경계를 강화하고 tool-specific 파일을 파생 adapter로 재정의했습니다.","event_id":"curated-revision-001","outcome":"원본 메모리와 각 도구의 표현 형식을 독립적으로 관리할 수 있게 됐습니다.","stage":"revision","title":"Revision"},{"context":"같은 작업 규칙을 여러 도구 파일에서 각각 수정하면 복사본이 쉽게 오래됐습니다.","date":"2026-03-19","decision":"하나의 canonical memory에서 adapter를 생성하도록 했습니다.","event_id":"curated-decision-001","outcome":"도구가 바뀌어도 작업기억 원본을 유지할 수 있게 됐습니다.","stage":"decision","title":"Decision"}]
