[{"context":"초기 handoff에는 실제 파일 확인과 시각 측정 근거가 부족했습니다.","date":"2026-03-31","decision":"확인 가능한 계산 엔진과 동작 테스트부터 구현 범위를 다시 고정했습니다.","event_id":"curated-revision-001","outcome":"구현 완료와 시각 검증 미완료를 구분해 기록할 수 있게 됐습니다.","stage":"revision","title":"Revision"},{"context":"UI 상태와 계산 로직이 한 파일에 섞이면 연속 입력 회귀를 찾기 어려웠습니다.","date":"2026-03-31","decision":"계산 엔진을 독립시키고 테스트 가능한 계약으로 만들었습니다.","event_id":"curated-decision-001","outcome":"화면을 바꿔도 연산 동작을 별도로 검증할 수 있게 됐습니다.","stage":"decision","title":"Decision"}]
