[{"context":"기록 관계를 보여주는 초기 지도 표현이 탐색 구조를 충분히 설명하지 못했습니다.","date":"2026-03-21","decision":"관계 지도를 좌표축 기반 dot layout으로 다시 설계했습니다.","event_id":"curated-revision-001","outcome":"기록의 위치와 관계를 더 직접적으로 탐색할 수 있게 됐습니다.","stage":"revision","title":"Revision"},{"context":"정적 파일 경로는 인증 UI를 우회해 민감 기록을 노출할 수 있었습니다.","date":"2026-03-21","decision":"서버 검증과 HttpOnly cookie를 접근 경계로 채택했습니다.","event_id":"curated-decision-001","outcome":"브라우저 정적 경로에서 비공개 원문을 분리했습니다.","stage":"decision","title":"Decision"}]
