[{"context":"전체 교체는 기존 경로의 회귀와 운영 중단 위험이 컸습니다.","date":"2026-08-24","decision":"feature flag와 bridge contract를 둔 점진적 전환 구조를 적용했습니다.","event_id":"curated-revision-001","outcome":"새 경로를 끄면 기존 직접 경로로 돌아갈 수 있게 됐습니다.","stage":"revision","title":"Revision"},{"context":"라우터가 내부 delegate까지 무제한으로 호출하면 책임과 비용을 추적하기 어려웠습니다.","date":"2026-08-24","decision":"상위 라우터와 전문가의 호출 깊이를 제한했습니다.","event_id":"curated-decision-001","outcome":"오케스트레이션 흐름과 실패 지점을 예측할 수 있게 됐습니다.","stage":"decision","title":"Decision"}]
