[{"context":"전역 상태에 의존한 판정은 서로 다른 세션의 신호를 섞었습니다.","date":"2026-02-18","decision":"세션 ID별 시간순 상태 머신으로 분석 전제를 다시 설계했습니다.","event_id":"curated-revision-001","outcome":"순서 오류와 세션 오분류를 별도로 추적할 수 있게 됐습니다.","stage":"revision","title":"Revision"},{"context":"전체 정렬을 메모리에서 수행하면 대용량 입력을 안정적으로 처리하기 어려웠습니다.","date":"2026-02-18","decision":"임시 SQLite 정렬과 스트리밍 처리를 사용했습니다.","event_id":"curated-decision-001","outcome":"메모리 사용을 제한하면서 월별 분석을 만들 수 있게 됐습니다.","stage":"decision","title":"Decision"}]
