[{"context":"dictionary 재생 평가 자산과 동사 학습 자산이 같은 프로젝트 범위를 차지했습니다.","date":"2026-04-13","decision":"사전 전환 자산을 별도 번들로 이동하고 동사 학습 흐름만 남겼습니다.","event_id":"curated-revision-001","outcome":"각 프로젝트의 데이터 소유와 실행 시작점이 명확해졌습니다.","stage":"revision","title":"Revision"},{"context":"데이터 자산 전체를 공개 서사에 포함하면 소유 경계와 개인정보 위험이 커졌습니다.","date":"2026-04-13","decision":"처리 단계와 데이터 원본을 분리해 방법론만 공개했습니다.","event_id":"curated-decision-001","outcome":"기술 흐름을 설명하면서 원본 자산을 로컬에 유지할 수 있게 됐습니다.","stage":"decision","title":"Decision"}]
