[{"context":"브라우저 저장소만으로는 웹과 데스크톱 위젯이 기록을 공유할 수 없었습니다.","date":"2026-02-12","decision":"단일 브라우저 저장 방식을 공용 API와 SQLite 구조로 전환했습니다.","event_id":"curated-revision-001","outcome":"여러 클라이언트가 같은 기록을 읽고 쓸 수 있게 됐습니다.","stage":"revision","title":"Revision"},{"context":"빠른 입력과 상세 관리를 한 화면에서 해결하면 기록 마찰이 다시 커졌습니다.","date":"2026-02-12","decision":"위젯은 입력, 웹은 조회와 관리에 집중하도록 역할을 분리했습니다.","event_id":"curated-decision-001","outcome":"기록 속도와 관리 기능을 동시에 유지했습니다.","stage":"decision","title":"Decision"}]
