[{"context":"첫 입력의 인코딩 오류와 누락 필드가 일부 지표를 잘못된 0으로 만들었습니다.","date":"2026-06-23","decision":"실패 실행을 보존한 채 제외하고 재업로드 데이터를 다시 검증했습니다.","event_id":"curated-revision-001","outcome":"분석 재현성과 잘못된 수치의 정정 이력을 함께 남겼습니다.","stage":"revision","title":"Revision"},{"context":"집계 결과를 바로 기능 후보로 바꾸면 데이터 품질과 활성화 문제를 놓칠 수 있었습니다.","date":"2026-06-23","decision":"품질 검증, 실패 분류와 제품 우선순위 단계를 분리했습니다.","event_id":"curated-decision-001","outcome":"분석 결과가 어떤 제품 판단을 지지하는지 명확해졌습니다.","stage":"decision","title":"Decision"}]
