[{"context":"정의 위주의 원고는 실제 서비스 흐름과 회의 판단으로 이어지지 않았습니다.","date":"2026-07-27","decision":"각 개념을 시나리오와 시스템 경계 및 확인 질문 중심으로 재구성했습니다.","event_id":"curated-revision-001","outcome":"기술 개념을 실무에서 관측되는 신호와 연결할 수 있게 됐습니다.","stage":"revision","title":"Revision"},{"context":"개별 용어 사전은 서비스가 어디에서 나뉘고 실패하는지를 보여주지 못했습니다.","date":"2026-07-27","decision":"시스템 경계와 데이터 흐름을 교재의 기본 설명 단위로 채택했습니다.","event_id":"curated-decision-001","outcome":"PM이 장애 위치와 다음 질문을 구조적으로 찾을 수 있게 됐습니다.","stage":"decision","title":"Decision"}]
