[{"context":"실시간 음성 루프와 대기 표시 및 예약 시각이 클라이언트별로 다르게 동작했습니다.","date":"2026-02-15","decision":"echo 방지, 대기 상태 축소와 시간대 정규화를 공용 계약에 반영했습니다.","event_id":"curated-revision-001","outcome":"즉시성은 유지하면서 반복 응답과 알림 시각 오류를 줄였습니다.","stage":"revision","title":"Revision"},{"context":"웹과 모바일이 서로 다른 데이터 규칙을 가지면 기록 이력이 끊겼습니다.","date":"2026-02-15","decision":"모든 클라이언트가 같은 API와 시간대 규칙을 사용하도록 했습니다.","event_id":"curated-decision-001","outcome":"입력 화면이 달라도 같은 기록과 알림 상태를 유지할 수 있게 됐습니다.","stage":"decision","title":"Decision"}]
