[{"context":"문서 규칙만으로는 다음 역할이 실제 실행을 생략해도 완료를 보고할 수 있었습니다.","date":"2026-04-05","decision":"실행기가 packet과 preview 및 검증 증거를 직접 검사하도록 강화했습니다.","event_id":"curated-revision-001","outcome":"서술형 완료와 실행된 결과를 구분할 수 있게 됐습니다.","stage":"revision","title":"Revision"},{"context":"에이전트 수를 늘려도 전달 형식이 약하면 같은 누락이 반복됐습니다.","date":"2026-04-05","decision":"역할 수보다 handoff 계약과 실패 시 재배분 규칙을 먼저 고정했습니다.","event_id":"curated-decision-001","outcome":"역할 간 전달 손실을 검사 가능한 운영 규칙으로 바꿨습니다.","stage":"decision","title":"Decision"}]
