[{"context":"문의 전송 경로가 서버 네트워크에서 반복적으로 지연됐습니다.","date":"2026-03-22","decision":"저장 책임과 브라우저 전송 책임을 분리하는 구조로 바꿨습니다.","event_id":"curated-revision-001","outcome":"확장 프로그램 기능과 운영 문의 기능의 장애 경계를 나눴습니다.","stage":"revision","title":"Revision"},{"context":"사용자 배경을 그대로 결과에 넣으면 불필요한 개인정보가 재노출될 수 있었습니다.","date":"2026-03-22","decision":"배경은 톤 판단에만 사용하고 출력에는 필요한 사실만 남겼습니다.","event_id":"curated-decision-001","outcome":"상황 반영과 개인정보 최소화를 함께 유지했습니다.","stage":"decision","title":"Decision"}]
