[{"context":"월간 일정과 주간 할 일을 동시에 보여주면 화면 밀도와 가독성이 충돌했습니다.","date":"2026-03-17","decision":"고정 6주 달력과 별도 주간 카드로 정보 계층을 나눴습니다.","event_id":"curated-revision-001","outcome":"월간 맥락과 당장 할 일을 한 화면 흐름에서 읽을 수 있게 됐습니다.","stage":"revision","title":"Revision"},{"context":"개인 일정 도구에 서버 운영을 추가하면 설치와 데이터 경로가 복잡해졌습니다.","date":"2026-03-17","decision":"Tkinter와 SQLite로 로컬 실행 범위를 고정했습니다.","event_id":"curated-decision-001","outcome":"외부 서비스 없이 실행 가능한 데스크톱 MVP가 됐습니다.","stage":"decision","title":"Decision"}]
