[{"context":"같은 전환 자산이 여러 프로젝트의 역할과 이력을 동시에 흐렸습니다.","date":"2026-04-13","decision":"관련 dictionary 자산을 별도 번들로 이동했습니다.","event_id":"curated-revision-001","outcome":"라우팅과 의미 학습 프로젝트의 범위를 각각 설명할 수 있게 됐습니다.","stage":"revision","title":"Revision"},{"context":"공용 자산을 어느 한 프로젝트의 구현 세부로 남기면 재사용 위치가 불명확했습니다.","date":"2026-04-13","decision":"독립된 transition bundle을 정본 위치로 채택했습니다.","event_id":"curated-decision-001","outcome":"공용 자산의 변경 책임과 참조 방향이 단순해졌습니다.","stage":"decision","title":"Decision"}]
