[{"context":"과거 결과와 최신 기준셋이 같은 위치에 섞여 어떤 결과가 현재 상태인지 불명확했습니다.","date":"2026-08-24","decision":"canonical benchmark, latest result와 archive 영역을 분리했습니다.","event_id":"curated-revision-001","outcome":"재실행 결과의 최신성과 비교 기준을 명확히 확인할 수 있게 됐습니다.","stage":"revision","title":"Revision"},{"context":"프롬프트와 runtime 정책이 따로 바뀌면 테스트 통과가 실제 동작을 보장하지 못했습니다.","date":"2026-08-24","decision":"전문가 프롬프트, 응답 스키마와 runtime 동기화를 품질 계약에 포함했습니다.","event_id":"curated-decision-001","outcome":"설계 자산과 실행 경로의 차이를 회귀 검증할 수 있게 됐습니다.","stage":"decision","title":"Decision"}]
