[{"context":"고정 주제 화면은 최근 사건의 변화와 기사 간 연결을 충분히 보여주지 못했습니다.","date":"2026-06-21","decision":"최근 창의 신호를 사용하는 동적 이슈 클러스터 구조로 전환했습니다.","event_id":"curated-revision-001","outcome":"고정 카테고리보다 현재 이슈의 흐름을 중심으로 탐색할 수 있게 됐습니다.","stage":"revision","title":"Revision"},{"context":"AI가 만든 관계를 즉시 공개하면 해석과 사실이 섞일 수 있었습니다.","date":"2026-06-21","decision":"AI 초안과 운영 검수를 분리하고 provenance를 보존했습니다.","event_id":"curated-decision-001","outcome":"사용자 화면에는 검증 상태를 설명할 수 있는 관계만 노출하게 됐습니다.","stage":"decision","title":"Decision"}]
