[{"context":"평가 범위를 넓히기 전에 현재 비교 흐름의 재현성을 고정해야 했습니다.","date":"2025-11-04","decision":"공통 입력과 독립 judge를 기준으로 평가 단계를 재구성했습니다.","event_id":"curated-revision-001","outcome":"프롬프트 변경 전후를 같은 조건에서 비교할 수 있게 됐습니다.","stage":"revision","title":"Revision"},{"context":"생성 모델이 자신의 응답을 직접 평가하면 기준이 흔들릴 수 있었습니다.","date":"2025-11-04","decision":"응답 생성과 품질 판정을 별도 역할로 분리했습니다.","event_id":"curated-decision-001","outcome":"평가 기준을 실행 대상과 독립적으로 관리할 수 있게 됐습니다.","stage":"decision","title":"Decision"}]
