[{"context":"OCR 결과를 자동 확정하면 라벨 인식 오류가 그대로 개인 기록에 들어갔습니다.","date":"2026-04-01","decision":"후보 제안 뒤 수동 확인하는 Human-in-the-loop 흐름으로 바꿨습니다.","event_id":"curated-revision-001","outcome":"자동화 속도와 데이터 정확성을 함께 관리할 수 있게 됐습니다.","stage":"revision","title":"Revision"},{"context":"OCR, 계정과 재고를 한 번에 만들면 핵심 기록 흐름을 검증하기 어려웠습니다.","date":"2026-04-01","decision":"라벨 인식과 수동 확인 및 셀러 저장만 MVP로 고정했습니다.","event_id":"curated-decision-001","outcome":"제품화 과제와 현재 완료 범위를 분리할 수 있게 됐습니다.","stage":"decision","title":"Decision"}]
