[{"context":"기존 명명과 다중값 및 삭제 규칙이 표 안에서 암묵적으로 해석됐습니다.","date":"2026-06-26","decision":"슬롯 상태와 별칭 및 생략 허용 규칙을 명시적인 매트릭스로 재정의했습니다.","event_id":"curated-revision-001","outcome":"템플릿 변경이 생성 결과에 미치는 영향을 비교할 수 있게 됐습니다.","stage":"revision","title":"Revision"},{"context":"생성기 내부 규칙만 고치면 비개발 검토자가 변경 이유를 확인하기 어려웠습니다.","date":"2026-06-26","decision":"사람이 읽는 매트릭스를 정본 명세로 두고 생성 규칙을 파생했습니다.","event_id":"curated-decision-001","outcome":"데이터 생성과 리뷰가 같은 기준을 공유하게 됐습니다.","stage":"decision","title":"Decision"}]
