[{"context":"부분 실행과 완주 실행 및 live 경로 결과가 같은 성과처럼 비교됐습니다.","date":"2026-08-24","decision":"실행 모드와 fallback 여부를 별도 검증 항목으로 재구성했습니다.","event_id":"curated-revision-001","outcome":"숫자를 과장하지 않고 각 결과가 증명하는 범위를 구분할 수 있게 됐습니다.","stage":"revision","title":"Revision"},{"context":"전체 전문가 실행은 비용이 크고 라우팅 계약의 원인을 분리하기 어려웠습니다.","date":"2026-08-24","decision":"먼저 route와 owner-route 계약을 고정한 뒤 검색과 실행 품질을 단계적으로 검증했습니다.","event_id":"curated-decision-001","outcome":"비용을 통제하면서 반복 가능한 품질 개선 경로를 만들었습니다.","stage":"decision","title":"Decision"}]
