[{"context":"일부 응답 스키마 제약이 실제 API 지원 범위와 맞지 않았습니다.","date":"2026-06-01","decision":"지원되지 않는 제약을 제거하고 선택적으로 스키마를 끌 수 있게 수정했습니다.","event_id":"curated-revision-001","outcome":"구조화 응답과 호환성 검증을 같은 도구에서 다룰 수 있게 됐습니다.","stage":"revision","title":"Revision"},{"context":"개발자 전용 스크립트만으로는 테스트 케이스를 넓게 검토하기 어려웠습니다.","date":"2026-06-01","decision":"스프레드시트를 시나리오 입력과 결과 검토 표면으로 채택했습니다.","event_id":"curated-decision-001","outcome":"실행 재현성과 사람 검토 가능성을 함께 확보했습니다.","stage":"decision","title":"Decision"}]
